{
  "$schema": "https://json-schema.org/draft/2020-12/schema",
  "$id": "urn:value-compass:schema:vc-envelope:1",
  "title": "Value Compass published-data envelope v1",
  "description": "Common wrapper for sibling summary.json files. The per-tool 'data' payload is described by config/schemas/summary/<tool>.schema.json. Contract: docs/ecosystem/data-contract.md",
  "type": "object",
  "required": ["schemaVersion", "tool", "kind", "generatedAt", "asOf", "sources", "contentHash", "data"],
  "additionalProperties": false,
  "properties": {
    "schemaVersion": {"const": 1},
    "tool": {
      "description": "Registry id (config/ecosystem.json tools[].id).",
      "type": "string",
      "pattern": "^[a-z0-9][a-z0-9_-]{0,63}$"
    },
    "kind": {"enum": ["summary"]},
    "generatedAt": {
      "description": "Build time, KST with explicit +09:00 offset. Not part of contentHash.",
      "type": "string",
      "pattern": "^\\d{4}-\\d{2}-\\d{2}T\\d{2}:\\d{2}:\\d{2}(\\.\\d{1,6})?\\+09:00$"
    },
    "asOf": {
      "description": "When the data is valid for: KST date or KST datetime with +09:00.",
      "type": "string",
      "pattern": "^\\d{4}-\\d{2}-\\d{2}(T\\d{2}:\\d{2}(:\\d{2}(\\.\\d{1,6})?)?\\+09:00)?$"
    },
    "sources": {
      "type": "array",
      "minItems": 1,
      "items": {
        "type": "object",
        "required": ["id", "name"],
        "additionalProperties": false,
        "properties": {
          "id": {"type": "string", "pattern": "^[a-z0-9][a-z0-9_.-]{0,63}$"},
          "name": {"type": "string", "minLength": 1},
          "url": {"type": "string", "pattern": "^https?://\\S+$"}
        }
      }
    },
    "contentHash": {
      "description": "sha256 of the canonical JSON of 'data' (sorted keys, ',' ':' separators, UTF-8, ECMAScript number formatting).",
      "type": "string",
      "pattern": "^sha256:[0-9a-f]{64}$"
    },
    "data": {"type": "object"}
  }
}
