{"asOf":"2026-09-27T08:47+09:00","contentHash":"sha256:1d5e66032f0630925befcea8e7fd7ec5f68cae8ce40880f7a3fe2b2581b56f5b","data":{"assets":[{"date":"2026-09-27","domesticPrice":190186.25,"gap":1.07,"intlPrice":188166.4,"key":"gold","label":"금","prevGap":1.07,"usdKrw":1354.4},{"date":"2026-09-27","domesticPrice":114769000,"gap":0.42,"intlPrice":114289797.47,"key":"bitcoin","label":"비트코인","prevGap":0.42,"usdKrw":1354.4},{"date":"2026-09-27","domesticPrice":3664000,"gap":0.44,"intlPrice":3648049.35,"key":"eth","label":"이더리움","prevGap":0.44,"usdKrw":1354.4},{"date":"2026-09-27","domesticPrice":1361,"gap":0.51,"intlPrice":1354.06,"key":"usdt","label":"USDT","prevGap":0.14,"usdKrw":1354.4}],"goldIntlMode":"ny_futures","updatedAt":"2026-09-27 08:47 KST"},"generatedAt":"2026-09-30T09:00:00+09:00","kind":"summary","schemaVersion":1,"sources":[{"id":"yahoo","name":"Yahoo Finance","url":"https://finance.yahoo.com/"},{"id":"upbit","name":"업비트","url":"https://upbit.com/"},{"id":"bithumb","name":"빗썸","url":"https://www.bithumb.com/"}],"tool":"gold_gap"}
