{"asOf":"2026-09-28","contentHash":"sha256:9f9185578fe12edba7db23f21f37a3aa452d4eae2104b2a6ad9e75b1a389cfa6","data":{"asOf":"2025-12-31","count":1529,"ratioAsOf":{"001720":"2025-03-31","033200":"2025-03-31"},"ratios":{"000660":3.61,"001720":53.1,"003120":46.15,"004700":46.57,"005930":1.55,"033200":35.77,"035420":4.64,"078000":44.11,"115310":54.18},"top":[{"asOf":"2025-12-31","code":"115310","endingQty":1730052,"issuedShares":3192883,"name":"인포바인","stockKind":"보통주식","treasuryRatioPct":54.1846},{"asOf":"2025-03-31","code":"001720","endingQty":8729975,"issuedShares":16440000,"name":"신영증권","stockKind":"보통주","treasuryRatioPct":53.102},{"asOf":"2025-12-31","code":"004700","endingQty":3096215,"issuedShares":6649138,"name":"조광피혁","stockKind":"보통주","treasuryRatioPct":46.5657},{"asOf":"2025-12-31","code":"003120","endingQty":6137953,"issuedShares":13300000,"name":"일성아이에스","stockKind":"보통주식","treasuryRatioPct":46.15},{"asOf":"2025-12-31","code":"078000","endingQty":4076074,"issuedShares":9240077,"name":"텔코웨어","stockKind":"보통주","treasuryRatioPct":44.113}]},"generatedAt":"2026-09-30T09:00:00+09:00","kind":"summary","schemaVersion":1,"sources":[{"id":"opendart","name":"OpenDART","url":"https://opendart.fss.or.kr/"},{"id":"kis-proxy","name":"KIS 시세 프록시"}],"tool":"buybacks"}
