{"asOf":"2026-09-23","contentHash":"sha256:62769e1441c37876e3c14fa574b2f2e7f248f57ad906e175fbd7c36bbb6d1513","data":{"allocation":{"asOf":"2026-09","classes":[{"key":"domestic_stock","label":"국내주식","pct":26.5},{"key":"foreign_stock","label":"해외주식","pct":35.1},{"key":"domestic_bond","label":"국내채권","pct":17},{"key":"foreign_bond","label":"해외채권","pct":5.7},{"key":"alternative","label":"대체투자","pct":15.4}],"estimated":true},"lastUpdated":"2026-09-25 15:48","source":"data.go.kr(2024-12-31)","summary":{"asOf":"2026-09-23","count":1081,"mtdPct":3.9628,"nav":3092.31,"todayPct":1.0137,"totalValue":423899242668346,"ytdPct":71.5429},"top":[{"changePct":3.255,"code":"005930","marketValue":123656382390000,"name":"삼성전자","ownershipPct":7.26,"sector":"전자부품·통신장비","weight":29.1712},{"changePct":1.1957,"code":"000660","marketValue":99574328546000,"name":"SK하이닉스","ownershipPct":7.55,"sector":"전자부품·통신장비","weight":23.4901},{"changePct":5.0309,"code":"402340","marketValue":13878898600000,"name":"SK스퀘어","ownershipPct":7.23,"sector":"금융","weight":3.2741},{"changePct":1.4132,"code":"009150","marketValue":11115005088000,"name":"삼성전기","ownershipPct":10.16,"sector":"전자부품·통신장비","weight":2.6221},{"changePct":-1.4229,"code":"105560","marketValue":5733118660400,"name":"KB금융","ownershipPct":8.4,"sector":"금융","weight":1.3525}]},"generatedAt":"2026-09-30T09:00:00+09:00","kind":"summary","schemaVersion":1,"sources":[{"id":"data-go-kr","name":"공공데이터포털 국민연금 보유종목","url":"https://www.data.go.kr/"},{"id":"opendart","name":"OpenDART","url":"https://opendart.fss.or.kr/"},{"id":"kis","name":"한국투자증권 Open API"}],"tool":"nps-tracker"}
