{"asOf":"2026-09-26T09:21:15+09:00","contentHash":"sha256:639df464da99f2f82d66476af37f671a96609fef42623d076ec25876bb33e1bf","data":{"averageRatio":183.77,"isPartial":false,"lastUpdated":"2026-09-26 09:21:15","pairCount":49,"pairs":[{"code":"000670","holdingName":"영풍","holdingValue":58728.9,"id":"youngpoong_koreazinc","marketCap":7721.8,"name":"영풍→고려아연","ratio":760.56,"ratioChange":14.45},{"code":"036710","holdingName":"심텍홀딩스","holdingValue":18519,"id":"simmtech_holdings","marketCap":2337.8,"name":"심텍홀딩스→심텍","ratio":792.16,"ratioChange":-43.13},{"code":"363280","holdingName":"티와이홀딩스","holdingValue":3614.2,"id":"ty_holdings","marketCap":806.8,"name":"티와이홀딩스→자회사","ratio":447.94,"ratioChange":9.44},{"code":"042420","holdingName":"네오위즈홀딩스","holdingValue":1207.5,"id":"neowiz_holdings","marketCap":1437,"name":"네오위즈홀딩스→네오위즈","ratio":84.03,"ratioChange":-0.25},{"code":"015360","holdingName":"INVENI","holdingValue":2664.3,"id":"inveni","marketCap":3730.3,"name":"INVENI→자회사","ratio":71.42,"ratioChange":-0.88},{"code":"000000","holdingName":"예시지주","holdingValue":null,"id":"example_missing_quote","marketCap":null,"name":"예시지주→예시자회사","ratio":null,"ratioChange":null}]},"generatedAt":"2026-09-30T09:00:00+09:00","kind":"summary","schemaVersion":1,"sources":[{"id":"kis-proxy","name":"KIS 시세 프록시"},{"id":"opendart","name":"OpenDART","url":"https://opendart.fss.or.kr/"}],"tool":"holding_value"}
