{"asOf":"2026-09-27T07:17:24+09:00","contentHash":"sha256:0df1f12339ee53ae9e8141ac288164b0f6de10eebb9df995ed92b6dd966052e9","data":{"marketSize":{"aboveGroundTonnes":219891,"date":"2025-12","goldDebtRatioPct":79.0963,"marketCapUsd":30463164137329,"miningTonnes":3300,"stockToFlowYears":66.6336},"prices":[{"changePct":8.2986,"date":"2026-08","id":"gold","name":"금","prevDate":"2026-07","prevValue":4073,"unit":"USD / troy oz","value":4411},{"changePct":11.2245,"date":"2026-08","id":"silver","name":"은","prevDate":"2026-07","prevValue":58.8,"unit":"USD / troy oz","value":65.4},{"changePct":8.8009,"date":"2026-08","id":"bitcoin","name":"비트코인","prevDate":"2026-07","prevValue":63866.405746,"unit":"USD / BTC","value":69487.215726},{"changePct":-1.4419,"date":"2026-08","id":"dollar","name":"달러 지수","prevDate":"2026-07","prevValue":100.959546,"unit":"index","value":99.50381},{"changePct":-5.7753,"date":"2026-08","id":"usdkrw","name":"달러/원","prevDate":"2026-07","prevValue":1491.77478,"unit":"KRW / USD","value":1405.620954}],"publishedAt":"2026-09-26T22:17:24.224637+00:00","ratios":{"bitcoinGold":15.7532,"date":"2026-08","goldSilver":67.4465}},"generatedAt":"2026-09-30T09:00:00+09:00","kind":"summary","schemaVersion":1,"sources":[{"id":"finance-pi","name":"finance-pi 공개 번들"},{"id":"worldbank","name":"World Bank Pink Sheet","url":"https://www.worldbank.org/en/research/commodity-markets"},{"id":"usgs","name":"USGS","url":"https://www.usgs.gov/"},{"id":"wgc","name":"World Gold Council","url":"https://www.gold.org/"}],"tool":"all-about-gold"}
