{"asOf":"2026-09-26T08:52:04+09:00","contentHash":"sha256:9434d83133b3c65b4f7af1e90f68f5f660796f42ae4ababef802858a617b3402","data":{"averageSpread":46.4,"averageSpreadChange":-0.26,"indexSpread":38.96,"indexSpreadChange":-0.22,"lastUpdated":"2026-09-26 08:52:04","pairs":[{"commonCode":"005930","commonPrice":286500,"date":"2026-09-23","id":"samsung_elec","name":"삼성전자","preferredCode":"005935","preferredName":"삼성전자우","preferredPrice":222000,"spread":22.51,"spreadChange":-1},{"commonCode":"005380","commonPrice":357000,"date":"2026-09-23","id":"hyundai_motor","name":"현대차/2우B","preferredCode":"005387","preferredName":"현대차2우B","preferredPrice":177600,"spread":50.25,"spreadChange":-1.07},{"commonCode":"005380","commonPrice":357000,"date":"2026-09-23","id":"hyundai_motor_pref","name":"현대차/우","preferredCode":"005385","preferredName":"현대차우","preferredPrice":177000,"spread":50.42,"spreadChange":-1.04},{"commonCode":"005380","commonPrice":357000,"date":"2026-09-23","id":"hyundai_motor_3pref","name":"현대차/3우","preferredCode":"005389","preferredName":"현대차3우B","preferredPrice":174800,"spread":51.04,"spreadChange":-0.56},{"commonCode":"336260","commonPrice":47300,"date":"2026-09-23","id":"doosan_fuelcell","name":"두산퓨얼셀/1우","preferredCode":"33626K","preferredName":"두산퓨얼셀1우","preferredPrice":6490,"spread":86.28,"spreadChange":-0.11},{"commonCode":"336260","commonPrice":47300,"date":"2026-09-23","id":"doosan_fuelcell_2pref","name":"두산퓨얼셀/2우B","preferredCode":"33626L","preferredName":"두산퓨얼셀2우B","preferredPrice":7790,"spread":83.53,"spreadChange":-0.29}]},"generatedAt":"2026-09-30T09:00:00+09:00","kind":"summary","schemaVersion":1,"sources":[{"id":"naver","name":"네이버 증권","url":"https://finance.naver.com/"}],"tool":"common_preferred_spread"}
