{"asOf":"2026-09-25T21:05:35+09:00","contentHash":"sha256:dd5cc20e7b9ed37169b7a0ad160904b9e48eb60d3993107e711f76c758291322","data":{"rankings":[{"code":"VGT","market":"미국","name":"Vanguard Information Tech ETF","rank":1,"score":80},{"code":"XLK","market":"미국","name":"State Street Technology Select","rank":2,"score":80},{"code":"SPYM","market":"미국","name":"State Street SPDR Portfolio S&P","rank":3,"score":77},{"code":"1321.T","market":"일본","name":"NOMURA ASSET MANAGEMENT CO LTD","rank":16,"score":74},{"code":"488770","market":"국내","name":"KODEX 머니마켓액티브","rank":31,"score":73}],"scoreModelVersion":"2.0.0","universe":["069500","1321.T","133690","360750","488770","QQQ","SPY","SPYM","VGT","VOO","XLK"],"universeSize":1390},"generatedAt":"2026-09-30T09:00:00+09:00","kind":"summary","schemaVersion":1,"sources":[{"id":"naver","name":"네이버 증권 ETF","url":"https://finance.naver.com/sise/etf.naver"},{"id":"yahoo","name":"Yahoo Finance","url":"https://finance.yahoo.com/"}],"tool":"eiayn"}
