{"asOf":"2026-09-28T23:21:19+09:00","contentHash":"sha256:f95a21081b6fae65fbae255ce6cb2365f966fe420aafb9b854512b9c804f3f1f","data":{"lastUpdated":"2026-09-28 23:21:19 KST","spacs":[{"annualizedReturn":4.06,"code":"0209J0","currentPrice":1891,"escrowRatePeriods":[{"ratePct":2.38,"startDate":"2026-09-15"}],"ipoPrice":2000,"liquidationDate":"2029-09-22","liquidationValuePerShare":2119.01,"listingDate":"2026-09-22","mergerStatus":null,"name":"KB제34호스팩","payoutDate":"2029-08-08","ratio":0.9455,"status":"공모가 이하","valuationBasis":{"anchor":null,"interestTaxPct":15.4,"rolloverMonths":12,"trustFeePct":0,"trustStartDate":"2026-09-15"}},{"annualizedReturn":4.6,"code":"0200G0","currentPrice":1891,"escrowRatePeriods":[{"ratePct":3,"startDate":"2026-09-15"}],"ipoPrice":2000,"liquidationDate":"2029-09-22","liquidationValuePerShare":2150.77,"listingDate":"2026-09-22","mergerStatus":null,"name":"한국제17호스팩","payoutDate":"2029-08-08","ratio":0.9455,"status":"공모가 이하","valuationBasis":{"anchor":null,"interestTaxPct":15.4,"rolloverMonths":12,"trustFeePct":0,"trustStartDate":"2026-09-15"}},{"annualizedReturn":6.02,"code":"0041J0","currentPrice":1941,"escrowRatePeriods":[{"ratePct":2.42,"startDate":"2025-07-11"},{"ratePct":3.22,"startDate":"2026-07-14"}],"ipoPrice":2000,"liquidationDate":"2028-07-22","liquidationValuePerShare":2142.2,"listingDate":"2025-07-22","mergerStatus":null,"name":"엘에스스팩1호","payoutDate":"2028-06-05","ratio":0.9705,"status":"공모가 이하","valuationBasis":{"anchor":{"date":"2026-07-14","valuePerShare":2038.8925},"interestTaxPct":15.4,"rolloverMonths":12,"trustFeePct":0.1,"trustStartDate":"2025-07-11"}},{"annualizedReturn":3.45,"code":"498390","currentPrice":2035,"escrowRatePeriods":[{"ratePct":2.83,"startDate":"2025-03-14"},{"ratePct":2.93,"startDate":"2026-03-17"}],"ipoPrice":2000,"liquidationDate":"2028-03-20","liquidationValuePerShare":2161.17,"listingDate":"2025-03-20","mergerStatus":"합병 확정","name":"한화플러스제5호스팩","payoutDate":"2028-07-07","ratio":1.0175,"status":"합병 확정","valuationBasis":{"anchor":{"date":"2026-03-17","valuePerShare":2046.1263},"interestTaxPct":15.4,"rolloverMonths":12,"trustFeePct":0.1,"trustStartDate":"2025-03-14"}}],"summary":{"averageAnnualizedReturn":4.4,"averageRatio":1.0123,"belowIpoCount":29,"totalCount":71},"valuationAssumptions":{"interestTaxPct":15.4,"payoutLagDays":102,"trustFeePct":0.1}},"generatedAt":"2026-09-30T09:00:00+09:00","kind":"summary","schemaVersion":1,"sources":[{"id":"krx","name":"KRX"},{"id":"kind","name":"KIND","url":"https://kind.krx.co.kr/"},{"id":"opendart","name":"OpenDART","url":"https://opendart.fss.or.kr/"},{"id":"naver","name":"네이버 증권","url":"https://finance.naver.com/"}],"tool":"spac-hunter"}
