{"asOf":"2026-09-27T07:11:51+09:00","contentHash":"sha256:6739203d26d777800c6a58918584afa67b2796af2667d7db80d5912b010086df","data":{"creditSpreadBp":{"A":67,"AA":58,"AAA":40,"B":286,"BB":164,"BBB":97,"CCC":1112},"fx":{"EUR_USD":{"change":-0.0015,"changePct":-0.131,"date":"2026-09-18","label":"유로/달러","value":1.1464},"USD_JPY":{"change":1.02,"changePct":0.654,"date":"2026-09-18","label":"달러/엔","value":156.87},"USD_KRW":{"change":7.51,"changePct":0.544,"date":"2026-09-18","label":"달러/원","value":1387.97}},"highlights":{"igHySpreadBp":1015,"krCurveSpreadBp":40.3,"usCurveInverted":false,"usCurveSpreadBp":30.5},"latestOffering":{"filingDate":"2026-08-07","issuer":"GOOGL","issuerName":"알파벳(구글)","totalAmount":25000000000,"tranches":10},"rates":{"KR10Y":{"change":0.017,"changePct":0.387,"country":"KR","date":"2026-09-26","maturity":10,"tenor":"10년","value":4.409},"KR1Y":{"change":-0.007,"changePct":-0.191,"country":"KR","date":"2026-09-23","maturity":1,"tenor":"1년","value":3.667},"KR3Y":{"change":-0.034,"changePct":-0.842,"country":"KR","date":"2026-09-23","maturity":3,"tenor":"3년","value":4.006},"KR_BASE":{"change":0,"changePct":0,"country":"KR","date":"2026-09-24","maturity":-1,"tenor":"기준금리","value":3},"US10Y":{"change":-0.015,"changePct":-0.29,"country":"US","date":"2026-09-25","maturity":10,"tenor":"10년","value":5.165},"US2Y":{"change":-0.01,"changePct":-0.205,"country":"US","date":"2026-09-25","maturity":2,"tenor":"2년","value":4.86},"US_BASE":{"change":0,"changePct":0,"country":"US","date":"2026-09-26","maturity":-1,"tenor":"기준금리","value":4},"US_ON":{"change":0.01,"changePct":0.258,"country":"US","date":"2026-09-24","maturity":0,"tenor":"익일물","value":3.88}}},"generatedAt":"2026-09-30T09:00:00+09:00","kind":"summary","schemaVersion":1,"sources":[{"id":"ecos","name":"한국은행 ECOS","url":"https://ecos.bok.or.kr/"},{"id":"bis","name":"BIS","url":"https://data.bis.org/"},{"id":"fred","name":"FRED","url":"https://fred.stlouisfed.org/"},{"id":"cnbc","name":"CNBC"}],"tool":"bond-mate"}
